{
  "analyzer": {
    "binary_sha256": "1111111111111111111111111111111111111111111111111111111111111111",
    "platform": {
      "arch": "x86_64",
      "os": "linux"
    },
    "release_tag": "v0.14.0"
  },
  "counts": {
    "analyzed": 1,
    "failed": 0,
    "feeds_scanned": 1,
    "generations_seen": 2,
    "new_generations": 1,
    "skipped": 1
  },
  "finished_at": "2026-09-24T01:34:12Z",
  "items": [
    {
      "action": "analyzed",
      "duration_ms": 850,
      "error_code": null,
      "feed_id": "Nagaibus",
      "message": null,
      "org_id": "nagai-unyu",
      "rid_observed": "current",
      "uid": "17ab34e1-dcb8-4b2e-9cda-ae2b68f4c444",
      "validation_status": "COMPLETE"
    }
  ],
  "run_id": "20260924T013000Z-12345678",
  "schema": "gtfs-fr-monitor-run/1",
  "started_at": "2026-09-24T01:30:00Z",
  "trigger": "local",
  "warnings": [
    {
      "code": "RID_ORDER_MISMATCH",
      "detail": "API rid order differs from from_date/published_at order",
      "feed_id": "Nagaibus",
      "org_id": "nagai-unyu"
    }
  ]
}
